**UF**, "**Forward Propagation Methods**", GC , M, Implemented
UF1,"Ability to use basic Monte Carlo and LHS methods", SP, M, Implemented
UF2,"Ability to use Importance Sampling", SP, M, Implemented
UF3,"Ability to use Own External UQ Engine", SP, M, Implemented
**UR**,"**Reliability Methods**", UF, M, Implemented
UR1,"Ability to use First Order Reliability method", UF, M, Implemented
UR2,"Ability to use Second Order Reliability method", UF, M, Implemented
UR3,"Ability to use Surrogate Based Reliability", UF, M, Implemented
UR4,"Ability to use Own External Application to generate Results", UF, Implemented
**US**,"**Sensitivity Methods**", UF, M, Implemented
US1,"Ability to obtain Global Sensitivity Sobol's indices", UF, M, Implemented
US2, "Ability to use probability model-based global sensitivity analysis (PM-GSA)", SP, M, Implemented
**UG**, "**Gaussian Process (GP) based Surrogate Models**",	UF, M, Implemented
UG1, "Ability to Construct GP Regression Model from a Simulation Model",	SP,	M, Implemented
UG2, "Ability to Construct GP Regression Model from Input-output Dataset",	SP,	M, Implemented
UG3, "Ability to use GP Regression", SP, M, Implemented
**UN**, "**Non-linear Least Squares Optimization**", SP, M, Implemented
UN1, "Ability to use Gauss-Newton solvers for parameter estimation", SP, M, Implemented
UN2, "Ability to read calibration data from file", UF, M, Implemented
UN3, "Ability to handle non-scalar response quantities", UF, M, Implemented
**UB**, "**Bayesian Calibration**", SP, M, Implemented
UB1, "Ability to use DREAM algorithm for Bayesian inference", SP, M, Implemented
UB2, "Ability to use TMCMC algorithm for Bayesian inference", SP, M, Implemented
UB3, "Ability to read calibration data from file", UF, M, InProgress
UB4, "Ability to handle non-scalar response quantities", UF, M, InpRogress
UB5, "Ability to calibrate multipliers on error covariance", UF, M, , 
UB6, "Ability to use a default log-likelihood function", UF, M, , 
