"P.2.4.5", "Allow users to prescribe the collapse probability of the structure","UF", "M", "Implemented", -, -, -, -, -, -
"**P.2.5**", "**Loss Model**", "**-**", "**-**", "**-**", "**-**", "**-**", "**-**", "**-**", "**-**", "**-**"
"P.2.5.1", "Allow users to decide which DVs to calculate","SP", "D", "Implemented", -, -, -, -, -, -
"P.2.5.2", "Allow users to specify the likelihood of various injuries in each collapse mode","SP", "D", "Implemented", -, -, -, -, -, -
"**P.3**", "**Hazard Model**", "**-**", "**-**", "**-**", "**-**", "**-**", "**-**", "**-**", "**-**", "**-**"
"**P.3.1**", "**Hazard Occurrence Rate**", "**-**", "**-**", "**-**", "**-**", "**-**", "**-**", "**-**", "**-**", "**-**"
"P.3.1.1", "Enable estimation of the likelihood of earthquake events","SP", "M", -, -, -, -, -, -, -
"P.3.1.2", "Enable estimation of the likelihood of wind events","SP", "M", -, -, -, -, -, -, -
"P.3.1.3", "Enable estimation of the likelihood of storm surge events","SP", "M", -, -, -, -, -, -, -
"P.3.1.4", "Enable estimation of the likelihood of tsunami events","SP", "M", -, -, -, -, -, -, -
"**P.4**", "**Response Model**", "**-**", "**-**", "**-**", "**-**", "**-**", "**-**", "**-**", "**-**", "**-**"
"**P.4.1**", "**EDP (re-)sampling**", "**-**", "**-**", "**-**", "**-**", "**-**", "**-**", "**-**", "**-**", "**-**"
"P.4.1.1", "Enable coupled assessment by using raw EDP values as-is","UF", "M", "Implemented", -, -, -, -, -, -
"P.4.1.2", "Enable non-Gaussian EDP distributions","UF", "D", -, -, -, -, -, -, -
"**P.4.2**", "**EDP Identification**", "**-**", "**-**", "**-**", "**-**", "**-**", "**-**", "**-**", "**-**", "**-**"
"P.4.2.1", "Implement automatic identification of required EDP types based on the performance model","SP", "M", -, -, -, -, -, -, -
"**P.5**", "**Performance Model**", "**-**", "**-**", "**-**", "**-**", "**-**", "**-**", "**-**", "**-**", "**-**"
"**P.5.1**", "**Auto-population of performance models**", "**-**", "**-**", "**-**", "**-**", "**-**", "**-**", "**-**", "**-**", "**-**"
"P.5.1.1", "Implement framework to enable user-defined auto-population scripts","UF", "D", "Implemented", -, -, -, -, -, -
"P.5.1.2", "Prepare script to perform auto-population based on normative quantities in FEMA P58","UF", "D", -, -, -, -, -, -, -
"**P.6**", "**Damage Model**", "**-**", "**-**", "**-**", "**-**", "**-**", "**-**", "**-**", "**-**", "**-**"
"**P.6.1**", "**Collapse estimation**", "**-**", "**-**", "**-**", "**-**", "**-**", "**-**", "**-**", "**-**", "**-**"
"P.6.1.1", "Estimate collapse probability of the structure using EDP limits and the joint distribution of EDPs","SP", "D", "Implemented", -, -, -, -, -, -
"P.6.1.2", "Estimate the collapse probability of the structure using empirical (raw) EDP data","UF", "M", "Implemented", -, -, -, -, -, -
"P.6.1.3", "Enable user-defined collapse probability","UF", "M", "Implemented", -, -, -, -, -, -
"**P.6.2**", "**Building Damage**", "**-**", "**-**", "**-**", "**-**", "**-**", "**-**", "**-**", "**-**", "**-**"
"P.6.2.1", "Implement earthquake fragility functions for building components from FEMA P58","SP", "M", "Implemented", -, -, -, -, -, -
"P.6.2.2", "Implement earthquake fragility functions for buildings from HAZUS","SP", "M", "Implemented", -, -, -, -, -, -
"P.6.2.3", "Implement wind fragility functions for buildings from HAZUS","SP", "M", "Implemented", -, -, -, -, -, -
"P.6.2.4", "Implement inundation fragility functions for buildings from HAZUS","SP", "M", "Implemented", -, -, -, -, -, -
"P.6.2.5", "Implement high-resolution wind fragility functions for building components","SP", "M", -, -, -, -, -, -, -
"P.6.2.6", "Implement high-resolution inundation fragility functions for building components","SP", "M", -, -, -, -, -, -, -
"**P.6.3**", "**Lifeline Damage**", "**-**", "**-**", "**-**", "**-**", "**-**", "**-**", "**-**", "**-**", "**-**"
"P.6.3.1", "Implement earthquake fragility functions for buried pipelines from HAZUS","SP", "M", -, -, -, -, -, -, -
"P.6.3.2", "Implement earthquake fragility functions for bridges from HAZUS","SP", "M", -, -, -, -, -, -, -
"P.6.3.3", "Implement earthquake fragility functions for power networks from HAZUS","SP", "M", -, -, -, -, -, -, -
"P.6.3.4", "Implement high-resolution fragility functions for buried pipelines","SP", "M", -, -, -, -, -, -, -
"P.6.3.5", "Implement high-resolution fragility functions for transportation networks","SP", "M", -, -, -, -, -, -, -
"**P.6.4**", "**Cascading Damages**", "**-**", "**-**", "**-**", "**-**", "**-**", "**-**", "**-**", "**-**", "**-**"
"P.6.4.1", "Implement fault tree-based cascading damage model","SP", "M", -, -, -, -, -, -, -
"**P.7**", "**Loss Model**", "**-**", "**-**", "**-**", "**-**", "**-**", "**-**", "**-**", "**-**", "**-**"
"**P.7.1**", "**Consequence functions for buildings**", "**-**", "**-**", "**-**", "**-**", "**-**", "**-**", "**-**", "**-**", "**-**"
"P.7.1.1", "Implement functions for repair cost and time as per FEMA P58","SP", "M", "Implemented", -, -, -, -, -, -
"P.7.1.2", "Implement functions for red tag triggering as per FEMA P58","SP", "M", "Implemented", -, -, -, -, -, -
"P.7.1.3", "Implement functions for injuries and fatalities as per FEMA P58","SP", "M", "Implemented", -, -, -, -, -, -
"P.7.1.4", "Implement functions for repair cost and time as per HAZUS earthquake","SP", "M", "Implemented", -, -, -, -, -, -
"P.7.1.5", "Implement functions for debris as per HAZUS earthquake","SP", "D", -, -, -, -, -, -, -
"P.7.1.6", "Implement functions for business interruption as per HAZUS earthquake","SP", "D", -, -, -, -, -, -, -
"P.7.1.7", "Implement functions for repair cost and time as per HAZUS wind","SP", "M", "Implemented", -, -, -, -, -, -
"P.7.1.8", "Implement functions for repair cost and time as per HAZUS inundation","SP", "M", -, -, -, -, -, -, -
"P.7.1.9", "Implement functions for environmental impact estimation as per FEMA P58 2nd edition","SP", "M", -, -, -, -, -, -, -
"P.7.1.10", "Implement functions for high-resolution repair cost and time assessment for wind hazards","SP", "M", -, -, -, -, -, -, -
"P.7.1.11", "Implement functions for high-resolution repair cost and time assessment for water hazards","SP", "M", -, -, -, -, -, -, -
"**P.7.2**", "**Consequence functions for other assets**", "**-**", "**-**", "**-**", "**-**", "**-**", "**-**", "**-**", "**-**", "**-**"
"P.7.2.1", "Implement functions for repair cost and time for buried pipelines as per HAZUS earthquake","SP", "M", "Implemented", -, -, -, -, -, -
"P.7.2.2", "Implement functions for repair cost and time for bridges as per HAZUS earthquake","SP", "M", -, -, -, -, -, -, -
"P.7.2.3", "Implement functions for repair cost and time for power networks as per HAZUS earthquake","SP", "M", -, -, -, -, -, -, -
"P.7.2.4", "Implement high-resolution functions for repair cost and time for transportation networks","SP", "M", -, -, -, -, -, -, -
"P.7.2.5", "Implement high-resolution functions for repair cost and time for buried pipelines","SP", "M", -, -, -, -, -, -, -
